Name,City,Website,Email,Phone,Instagram,Notes
Meche Salon,Los Angeles,https://mechesalon.com,,+1 310-274-3900,@mechesalon,Beverly Hills luxury color and cuts; A-list clientele
Chris McMillan Salon,Los Angeles,https://www.chrismcmillansalon.com,,+1 310-858-1244,@chrismcmillan,West Hollywood; famous for Jennifer Aniston's "Rachel" cut
Sally Hershberger Los Angeles,Los Angeles,https://www.sallyhershberger.com,,+1 310-274-8202,@sallyhershberger,Beverly Hills location of iconic NYC/LA stylist
Mèche Salon Beverly Hills,Los Angeles,https://mechesalon.com,,+1 310-274-3900,@mechesalon,Top-rated Beverly Hills hair color destination
Benjamin Salon,Los Angeles,https://www.benjaminsalonla.com,,+1 310-867-3004,@benjaminsalonla,West Hollywood; color balayage specialist
Andy Lecompte Salon,Los Angeles,https://www.andylecompte.com,,+1 310-247-8080,@andylecompte,West Hollywood A-list salon; Katy Perry's colorist
Ken Paves Salon,Los Angeles,https://www.kenpaves.com,,+1 323-856-9998,@kenpaves,West Hollywood celeb hair; extensions specialist
Byron & Tracey Salon,Los Angeles,https://www.byronandtracey.com,,+1 310-275-0105,@byronandtracey,Beverly Hills luxury salon; over 25 years in business
Nine Zero One Salon,Los Angeles,https://www.ninezeroonesalon.com,,+1 310-858-4717,@ninezeroonesalon,West Hollywood; fashion and editorial cuts
Christine Margossian Hair,Los Angeles,https://www.christinemargossian.com,,+1 310-274-0023,@christinemargossian,Beverly Hills boutique; precision cuts
Umberto Beverly Hills,Los Angeles,https://www.umberto.com,,+1 310-274-8688,@umbertohair,Iconic Beverly Hills salon; celebrity and runway stylist
Ramirez|Tran Salon,Los Angeles,https://www.ramirez-tran.com,,+1 323-424-5070,@ramireztran,West Hollywood; balayage and lived-in color pioneers
Gene Juarez Salon,Los Angeles,https://www.genejuarez.com,,+1 310-276-4334,@genejuarez,Beverly Hills full-service salon and spa
Martino Cartier Salon,Los Angeles,https://www.martinocartier.com,,+1 213-387-5555,@martinocartier,Midtown LA upscale; styling and color
Yosh for Hair,Los Angeles,https://www.yoshforhair.com,,+1 213-629-0811,@yoshforhair,Downtown LA; avant-garde cuts and color
Taz Angeles,Los Angeles,https://www.tazangeles.com,,+1 323-938-2800,@tazangeles,West Hollywood; known for transformative color
The Dry House,Los Angeles,https://www.thedryhouse.com,,+1 310-657-3733,@thedryhouse,WeHo blowout bar; quick-service hair
Squeeze Dry,Los Angeles,https://www.squeezedryla.com,,+1 310-432-6500,@squeezedryla,Beverly Hills blowout bar; popular local chain
Serge Normant Salon LA,Los Angeles,https://sergeathome.com,,+1 310-859-7700,@sergeathome,West Hollywood; European-trained stylists
Avante Salon,Los Angeles,https://www.avantesalon.com,,+1 310-855-0400,@avantesalon,West Hollywood; color and treatments specialist
