Name,City,Website,Email,Phone,Instagram,Notes
Dishoom,London,dishoom.com,info@dishoom.com,+442077204000,@dishoom,Multiple London sites; cult Bombay café brand; huge IG following
Sketch London,London,sketch.london,info@sketch.london,+442077774488,@sketchlondon,Mayfair iconic restaurant and arts venue; stunning visuals
Gymkhana,London,gymkhanalondon.com,info@gymkhanalondon.com,+442030114040,@gymkhanalondon,Michelin-starred Indian in Mayfair; high-end crowd
The Ledbury,London,theledbury.com,info@theledbury.com,+442077929090,@theledbury,Two Michelin stars in Notting Hill; world-class
Hawksmoor,London,thehawksmoor.com,info@thehawksmoor.com,+442073771899,@hawksmoor,Premium steakhouse; multiple London sites; strong brand
Ottolenghi,London,ottolenghi.co.uk,info@ottolenghi.co.uk,+442072880455,@ottolenghi,Yotam Ottolenghi delis & restaurants; Islington/Notting Hill
St. John Restaurant,London,stjohnrestaurant.com,info@stjohnrestaurant.com,+442072510848,@stjohn_restaurant,Clerkenwell nose-to-tail pioneer; Michelin starred
Roka,London,rokarestaurant.com,info@rokarestaurant.com,+442075804447,@rokarestaurant,Japanese robatayaki; multiple London sites; upscale
Flat Iron,London,flatironsteak.co.uk,info@flatironsteak.co.uk,+442074940143,@flatiron_steak,Affordable quality steak; multiple London locations; cult following
Brat,London,bratrestaurant.com,info@bratrestaurant.com,+442073432478,@bratrestaurant,Shoreditch Basque-inspired; Michelin starred; top Insta visuals
Berber & Q,London,berberandq.com,info@berberandq.com,+442078126590,@berberandq,Hackney Middle Eastern grill; very popular brunch
Som Saa,London,somsaa.com,info@somsaa.com,+442038240753,@somsaa,Spitalfields Thai; consistently top rated; independent
Brunswick House,London,brunswickhouse.london,info@brunswickhouse.london,+442078403926,@brunswickhouselondon,Vauxhall restaurant in antiques showroom; stunning setting
Kiln,London,kilnsoho.com,info@kilnsoho.com,+442037347122,@kilnsoho,Soho Thai counter dining; always a queue; strong word of mouth
10 Greek Street,London,10greekstreet.com,info@10greekstreet.com,+442077340676,@10greekstreet,Soho neighbourhood bistro; loyal following; small plates
Pho,London,phocafe.co.uk,info@phocafe.co.uk,+442073790379,@phocafe,Vietnamese chain across London; healthy eating crowd
Bao,London,baolondon.com,info@baolondon.com,+442077042076,@baolondon,Taiwanese buns; multiple London sites; always queues; great IG
Brigadiers,London,brigadiersrestaurant.com,info@brigadiersrestaurant.com,+442038631400,@brigadiersrestaurant,Indian BBQ in the City; sports bar vibe; JKS Restaurants
Padella,London,padella.co,info@padella.co,+442075925176,@padella_pasta,Borough Market pasta bar; always a queue; fresh pasta focus
The Clove Club,London,thecloveclub.com,info@thecloveclub.com,+442077290600,@thecloveclub,Shoreditch tasting menu; Michelin starred; iconic London restaurant
